{
  "schema_ref": "design/system_v3/07_Responsive_System/Page_Responsive_Envelope_Schema_V1.json",
  "schema_version": "1.0",
  "contract_id": "PAGE_RESPONSIVE_AUTH_LOGIN_V2",
  "contract_version": "1.0",
  "status": "DRAFT",
  "page": {
    "page_id": "auth_login_v2",
    "route": "auth/login",
    "owner_path": "design/pages/account_privacy/Login",
    "implementation_entrypoints": [
      {
        "kind": "runtime",
        "path": "app/src/main/java/com/yujian/ai/YujianApp.kt"
      },
      {
        "kind": "runtime",
        "path": "app/src/main/java/com/yujian/ai/ui/auth/LoginV2Screen.kt"
      }
    ]
  },
  "authority_refs": [
    {
      "authority_ref_id": "responsive-standard",
      "role": "GLOBAL_STANDARD",
      "path": "design/system_v3/07_Responsive_System/Responsive_Layout_Standard_V1.md",
      "sha256": "1b302c8d6a65af1c20581ed95a9014600040af8565ab890d11882ce3183e2dcf"
    },
    {
      "authority_ref_id": "login-behavior",
      "role": "PAGE_BEHAVIOR",
      "path": "design/pages/account_privacy/Login/Login_V2_Closure.md",
      "sha256": "e0979ad8df0faa11f9c3471a54d80ac460fe32fd9bf53a80cf42061b9008f5d1"
    },
    {
      "authority_ref_id": "login-visual-spec",
      "role": "PAGE_VISUAL_SPEC",
      "path": "design/pages/account_privacy/Login/Login_V2_BG_CONTENT_Revision_V2_1.md",
      "sha256": "ca088c4f131095c7160cc1d88a532c967e244704d6337340c8889ced2dec7bf5"
    },
    {
      "authority_ref_id": "login-visual-authority",
      "role": "PAGE_VISUAL_AUTHORITY",
      "path": "design/pages/account_privacy/Login/frozen/Login_V2_1_Frozen_Final.png",
      "sha256": "c9323f11a9d935f8e98b95276a73930b549b20262eddb5a57968a10835c7486e"
    },
    {
      "authority_ref_id": "login-responsive-matrix",
      "role": "RESPONSIVE_NUMERIC_AUTHORITY",
      "path": "design/pages/account_privacy/Login/Login_Responsive_Acceptance_Matrix_V1.json",
      "sha256": "4b155d072c659d72ef979c5e2b3a38d076aa651b71b9769f89eee9faa3cdd571"
    }
  ],
  "coordinate_space": {
    "space_id": "android-logical-layout",
    "unit": "dp",
    "origin": "top_start",
    "transform_owner": "page_implementation"
  },
  "safe_area": {
    "policy_ref": {
      "authority_ref_id": "login-visual-spec",
      "locator": "/safe-area-policy",
      "resolution_mode": "REFERENCE_ONLY"
    },
    "preview_inset_owner": "unverified",
    "runtime_inset_owner": "unverified",
    "consume_each_inset_once": true
  },
  "viewport_inputs": {
    "width_input": "logicalViewportWidth",
    "height_input": "logicalViewportHeight",
    "dimension_unit": "dp",
    "font_scale_input": "systemFontScale",
    "orientation_input": "orientation",
    "viewport_authority_ref_id": "login-responsive-matrix"
  },
  "conformance_profile_ref": {
    "profile_id": "auth-login-responsive-profile-candidate-v1",
    "path": "design/system_v3/07_Responsive_System/page_contract_examples/auth_login_v2.profile.json",
    "sha256": "e60419a5d38b2cd15364b97d8b0d12adc51d3a2251eb3a2d8f9504015eef1ea1"
  },
  "validator_binding": {
    "adapter_id": "schema_only_draft",
    "adapter_path": "scripts/design/page_contract_adapters/schema_only_draft.py",
    "adapter_version": "1.0"
  },
  "resource_binding_refs": [
    {
      "binding_id": "auth_login_v2-resources",
      "manifest_path": "design/pages/account_privacy/Login/frozen/manifest.json",
      "owner_task": "W2",
      "validation_scope": "STRUCTURE_ONLY"
    }
  ],
  "validation_bindings": {
    "envelope_schema": "design/system_v3/07_Responsive_System/Page_Responsive_Envelope_Schema_V1.json",
    "profile_schema": "design/system_v3/07_Responsive_System/Page_Conformance_Profile_Schema_V1.json",
    "generic_validator": "scripts/design/validate_page_responsive_contract.py",
    "gate_id": "G-PAGE-FREEZE-PIPELINE-W1-CONTRACT"
  },
  "acceptance": {
    "contract": "NOT_VERIFIED",
    "browser": "NOT_VERIFIED",
    "native_runtime": "NOT_VERIFIED",
    "evidence": "NOT_VERIFIED",
    "assets": "NOT_VERIFIED",
    "page_state": "NOT_VERIFIED"
  },
  "evidence_refs": [],
  "state_scope": {
    "included_state_refs": [
      {
        "authority_ref_id": "login-responsive-matrix",
        "locator": "/state_ids",
        "resolution_mode": "REFERENCE_ONLY"
      }
    ],
    "excluded_scope_refs": [],
    "status": "DECLARED"
  }
}
